{
  "schema_version": 1,
  "method_version": "0.3.0",
  "profile_id": "software-example",
  "policy": {
    "scope": [
      "One software repository and its local verification surfaces"
    ],
    "canonical_sources": [
      {
        "id": "current-code",
        "owns": "Current implemented behavior",
        "precedence": 1
      },
      {
        "id": "accepted-design",
        "owns": "Accepted intent and architecture",
        "precedence": 2
      },
      {
        "id": "work-control",
        "owns": "Authorized future work and status",
        "precedence": 3
      }
    ],
    "actions": {
      "allowed": [
        "repository.read",
        "repository.write",
        "local-test.run"
      ],
      "forbidden": [
        "remote.push",
        "release.publish",
        "deployment.mutate",
        "secret.read"
      ]
    },
    "protocols": {
      "program": false,
      "experiment": false,
      "secrets": false
    },
    "gates": [
      {
        "id": "focused-tests",
        "default": true,
        "before": "completion",
        "required_evidence": "Focused checks selected by the changed failure class and bound to the exact revision"
      }
    ],
    "secrets": {
      "routine_access": "forbidden without a task-specific authority",
      "approved_references": [
        "secret-ref:<logical-name>"
      ],
      "delivery": "provider-managed injection directly to the intended process",
      "artifact_scan": "project non-revealing secret scan before durable publication",
      "exposure_response": "notify the repository credential-response owner",
      "forensic_quarantine": "restricted store outside model context with explicit retention and audit",
      "clean_context": "new transcript and process state after leak-path canary evidence",
      "encrypted_envelopes": "forbidden unless separately accepted by the repository owner"
    },
    "program": {
      "trigger": "persistent dependent migration, multiple repositories, or shared external state",
      "repair_authority": "repository owner through an authority source independent of the invalidated control"
    },
    "reporting": "task outcome with exact test and revision evidence"
  },
  "acceptance": {
    "status": "draft",
    "policy_sha256": "",
    "authority_source": "",
    "accepted_by": "",
    "accepted_at": "",
    "receipt": ""
  }
}
