{
  "schema_version": 1,
  "method_version": "0.3.0",
  "profile_id": "operations-example",
  "policy": {
    "scope": [
      "One operational environment and its approved change controls"
    ],
    "canonical_sources": [
      {
        "id": "live-state",
        "owns": "Current observable system state",
        "precedence": 1
      },
      {
        "id": "change-control",
        "owns": "Accepted desired state and mutation authority",
        "precedence": 2
      },
      {
        "id": "runbook",
        "owns": "Current operating procedure and ownership",
        "precedence": 3
      }
    ],
    "actions": {
      "allowed": [
        "operation.inspect",
        "operation.plan",
        "operation.execute"
      ],
      "forbidden": [
        "credential.rotate",
        "data.delete",
        "authority.delegate"
      ]
    },
    "protocols": {
      "program": false,
      "experiment": false,
      "secrets": false
    },
    "gates": [
      {
        "id": "change-verification",
        "default": true,
        "before": "completion",
        "required_evidence": "Preflight, stop/recovery path, and post-change behavior bound to the exact target"
      }
    ],
    "secrets": {
      "routine_access": "requires a task-specific credential authority",
      "approved_references": [
        "credential-ref:<logical-name>"
      ],
      "delivery": "provider-managed injection to the approved process",
      "artifact_scan": "non-revealing scan over changed durable operational artifacts",
      "exposure_response": "invoke the credential response owner and stop self-controlled propagation",
      "forensic_quarantine": "restricted incident store with named access, retention, and audit",
      "clean_context": "fresh coordination and execution context after a non-secret canary",
      "encrypted_envelopes": "allowed only when the destination exclusively controls decryption"
    },
    "program": {
      "trigger": "persistent coordinated rollout across environments or shared state",
      "repair_authority": "change owner independent of the invalidated rollout control"
    },
    "reporting": "change outcome with target, artifact, recovery, and live-state receipts"
  },
  "acceptance": {
    "status": "draft",
    "policy_sha256": "",
    "authority_source": "",
    "accepted_by": "",
    "accepted_at": "",
    "receipt": ""
  }
}
