{
  "schema_version": 1,
  "method_version": "0.3.0",
  "profile_id": "research-example",
  "policy": {
    "scope": [
      "One bounded research question and its local analysis artifacts"
    ],
    "canonical_sources": [
      {
        "id": "primary-evidence",
        "owns": "Direct observations, original data, and primary sources",
        "precedence": 1
      },
      {
        "id": "reproducible-analysis",
        "owns": "Derived measurements and transformations",
        "precedence": 2
      },
      {
        "id": "research-control",
        "owns": "Accepted question, scope, and publication decisions",
        "precedence": 3
      }
    ],
    "actions": {
      "allowed": [
        "source.read",
        "analysis.local",
        "artifact.write"
      ],
      "forbidden": [
        "participant.contact",
        "dataset.mutate-shared",
        "result.publish",
        "secret.read"
      ]
    },
    "protocols": {
      "program": false,
      "experiment": false,
      "secrets": false
    },
    "gates": [
      {
        "id": "claim-evidence",
        "default": true,
        "before": "completion",
        "required_evidence": "Cited primary evidence with explicit inference and material uncertainty"
      }
    ],
    "secrets": {
      "routine_access": "restricted material remains in its approved source system",
      "approved_references": [
        "restricted-source:<logical-id>"
      ],
      "delivery": "approved viewer or analysis process without model-visible values",
      "artifact_scan": "publication disclosure scan with non-revealing output",
      "exposure_response": "notify the material owner without repeating the material",
      "forensic_quarantine": "source-system quarantine outside model context",
      "clean_context": "fresh analysis context after confirmed path closure",
      "encrypted_envelopes": "forbidden unless the destination alone controls decryption"
    },
    "program": {
      "trigger": "persistent study with dependent questions, collection, and publication gates",
      "repair_authority": "research sponsor independent of the invalidated study control"
    },
    "reporting": "cited answer with source strength, inference, and uncertainty"
  },
  "acceptance": {
    "status": "draft",
    "policy_sha256": "",
    "authority_source": "",
    "accepted_by": "",
    "accepted_at": "",
    "receipt": ""
  }
}
